{"inputs":[0],"kind":"rkir","name":"matmul","ops":[{"attrs":{"b_layout":"kn","numeric_contract":{"accumulation":"ordered_k_tiles_with_f16_writeback","accumulator_dtype":"float16","approximate":false,"input_dtype":"float16","narrowing_points":["k_tile_boundary"],"output_dtype":"float16","tolerance":{"atol":0.008,"rtol":0.008}}},"id":0,"inputs":[0,1],"opcode":"matmul","outputs":[2],"side_effects":false,"source":"rk-builder:matmul"}],"outputs":[2],"profile_hash":"","schema_version":1,"source_hash":"builder","state_signature":"","values":[{"id":0,"name":"A","producer":null,"role":"input","type":{"axes":["row","col"],"dtype":"float16","finite":true,"index_map":"identity","shape":[32,64]}},{"id":1,"name":"B","producer":null,"role":"constant","type":{"axes":["row","col"],"dtype":"float16","finite":true,"index_map":"identity","shape":[64,48]}},{"id":2,"name":"Y","producer":0,"role":"output","type":{"axes":["row","col"],"dtype":"float16","finite":true,"index_map":"identity","shape":[32,48]}}]}
